uri,lang,isDuplicate,date,time,dateTime,dateTimePub,dataType,sim,url,title,body,authors,image,eventUri,sentiment,wgt,relevance,source.uri,source.dataType,source.title,feed date
8314411288,eng,False,2024-09-10,05:51:47,2024-09-10T05:51:47Z,2024-09-10T05:51:20Z,news,0.7216,https://www.dailymail.co.uk/news/article-13829679/watch-presidential-debate-Donald-Trump-Kamala-Harris.html,Everything to know about the debate between Trump and Harris,"By Katelyn Caralle, Senior U.S. Political Reporter In Philadelphia, Pennsylvania

The time has come for Donald Trump and Kamala Harris to meet on stage for what could be one of the most consequential ...",[],https://i.dailymail.co.uk/1s/2024/09/10/06/89448271-0-image-a-7_1725947200276.jpg,eng-9888611,0.0118,463643507,1,dailymail.co.uk,news,Daily Mail Online,2024-09-10
8314409434,eng,False,2024-09-10,05:49:48,2024-09-10T05:49:48Z,2024-09-10T05:49:37Z,news,0.4471,https://www.thehindubusinessline.com/multimedia/video/ahead-of-presidential-debate-trump-threatens-to-jail-opponents-harris-campaign-condemns-statement/article68624879.ece,"Ahead of Presidential debate, Trump threatens to jail opponents; Harris campaign condemns statement","Ahead of the much-awaited face-off between US Vice President Kamala Harris and former President Donald Trump at the National Constitution Center, Trump took to social media to warn so-called cheaters ...",[],https://bl-i.thgim.com/public/incoming/v3bifh/article68624877.ece/alternates/LANDSCAPE_1200/Daily%20News%20Thumbnail.png,eng-9884926,-0.3098,463643388,1,thehindubusinessline.com,news,@businessline,2024-09-10
8314395030,eng,False,2024-09-10,05:37:13,2024-09-10T05:37:13Z,2024-09-10T05:36:43Z,news,0.6078,https://economictimes.indiatimes.com/news/international/world-news/kamala-harris-vs-donald-trump-presidential-debate-what-you-can-expect/articleshow/113214179.cms,Kamala Harris vs. Donald Trump Presidential Debate: What you can expect?,"US Presidential Debate 2024: Kamala Harris and Donald Trump are preparing for Tuesday's presidential debate with contrasting strategies. Harris is focused on refining her responses, while Trump ...",[],"https://img.etimg.com/thumb/msid-113214341,width-1200,height-630,imgsize-88026,overlay-economictimes/photo.jpg",eng-9887610,0.1529,463642633,34,economictimes.indiatimes.com,news,Economic Times,2024-09-10
8314381011,eng,False,2024-09-10,05:25:12,2024-09-10T05:25:12Z,2024-09-10T05:24:37Z,news,0.7608,https://www.latestly.com/agency-news/entertainment-news-saturday-night-live-adds-three-new-cast-members-for-50th-season-6254394.html,Entertainment News | 'Saturday Night Live' Adds Three New Cast Members for 50th Season | LatestLY,"Washington [US], September 10 (ANI): Saturday Night Live is gearing up for its milestone 50th season with some fresh faces. NBC has announced that Ashley Padilla, Emil Wakim, and Jane Wickline will ...",[],https://st1.latestly.com/wp-content/uploads/2024/09/ANI-20240910045308-588x441.jpg,eng-9889735,0.1922,463641912,1,latestly.com,news,LatestLY,2024-09-10
8314367055,eng,True,2024-09-10,05:12:55,2024-09-10T05:12:55Z,2024-09-10T05:12:05Z,news,0.0,https://www.yahoo.com/entertainment/taylor-swift-faces-backlash-brittany-205147551.html,Taylor Swift faces backlash for Brittany Mahomes friendship amid Trump controversy,"Taylor Swift is facing fan criticism after she was seen warmly embracing Brittany Mahomes, who last week was praised by Donald Trump for ""strongly defending"" him against online controversy.

Swift and ...",[],https://media.zenfs.com/en/the_independent_635/08bc2e26c37a9c7c9fad716ae0b52b05,,0.1059,463641175,1,yahoo.com,news,Yahoo,2024-09-10
8314367065,eng,False,2024-09-10,05:12:23,2024-09-10T05:12:23Z,2024-09-10T05:12:05Z,news,0.6627,https://www.yahoo.com/lifestyle/sorry-taylor-swift-friendships-cross-050000831.html,"Sorry, Taylor Swift - friendships that cross political lines never work","Taylor Swift's most divisive move yet? Hugging a rumoured Republican. Over the weekend, the singer was photographed embracing her pal Brittany Mahomes, who's thought to be a Trump supporter. Cue the ...",[],https://media.zenfs.com/en/the_independent_577/5020badb8b0a856f2d73b8de96ea7262,eng-9889411,0.349,463641143,1,yahoo.com,news,Yahoo,2024-09-10
8314360584,eng,False,2024-09-10,05:06:41,2024-09-10T05:06:41Z,2024-09-10T05:06:27Z,news,0.7294,https://www.independent.co.uk/arts-entertainment/music/news/taylor-swift-brittany-mahomes-friendship-trump-politics-b2609949.html,Taylor Swift faces backlash for Brittany Mahomes friendship amid Trump controversy,"In my reporting on women's reproductive rights, I've witnessed the critical role that independent journalism plays in protecting freedoms and informing the public.

Your support allows us to keep ...",[],https://static.independent.co.uk/2024/09/09/15/GettyImages-2170852669.jpg?quality=75&width=1200&auto=webp,eng-9889411,0.3176,463640801,1,independent.co.uk,news,The Independent,2024-09-10
8314356100,eng,False,2024-09-10,05:02:33,2024-09-10T05:02:33Z,2024-09-10T05:02:14Z,news,0.5922,https://www.independent.co.uk/life-style/taylor-swift-brittany-mahomes-friendship-politics-b2609502.html,"Sorry, Taylor Swift - friendships that cross political lines never work","In my reporting on women's reproductive rights, I've witnessed the critical role that independent journalism plays in protecting freedoms and informing the public.

Your support allows us to keep ...",[],https://static.independent.co.uk/2024/09/09/14/newFile.jpg?quality=75&width=1200&auto=webp,eng-9889411,0.4275,463640553,1,independent.co.uk,news,The Independent,2024-09-10
2024-09-480463624,eng,True,2024-09-10,04:58:37,2024-09-10T04:58:37Z,2024-09-10T04:57:03Z,news,0.0,https://dailytimes.com.pk/1225246/trump-harris-in-final-prep-for-crucial-debate/,"Trump, Harris in final prep for crucial debate","Kamala Harris and Donald Trump made their final preparations Monday on the eve of their first - and possibly only - televised debate before the knife-edge 2024 US presidential election.

With less ...","{'uri': ['sajid_salamat@dailytimes.com.pk'], 'name': ['Sajid Salamat'], 'type': ['author'], 'isAgency': [False]}",https://dailytimes.com.pk/assets/uploads/2024/09/10/f9814f91-e917-4955-880c-255cd9d47cc5.jpg,,-0.2235,463640317,1,dailytimes.com.pk,news,Daily Times,2024-09-10
8314350841,eng,False,2024-09-10,04:56:51,2024-09-10T04:56:51Z,2024-09-10T04:56:39Z,news,0.8275,https://www.aninews.in/news/entertainment/hollywood/saturday-night-live-adds-three-new-cast-members-for-50th-season20240910102324/,'Saturday Night Live' adds three new cast members for 50th season,"Washington [US], September 10 (ANI): Saturday Night Live is gearing up for its milestone 50th season with some fresh faces. NBC has announced that Ashley Padilla, Emil Wakim, and Jane Wickline will ...",[],https://d3lzcn6mbbadaf.cloudfront.net/media/details/ANI-20240910045308.jpg,eng-9889735,0.1529,463640211,1,aninews.in,news,Asian News International (ANI),2024-09-10
2024-09-480449189,eng,False,2024-09-10,04:34:26,2024-09-10T04:34:26Z,2024-09-10T04:05:34Z,news,0.5882,https://pittnews.com/article/189538/opinions/opinion-stop-questioning-kamala-harriss-identity/,Opinion | Stop questioning Kamala Harris's identity,"I am tired of acting like Vice President Kamala Harris's race doesn't already play a large role in the upcoming 2024 presidential election. In recent weeks, it has been hard to find a headline that ...",[],https://pittnews.com/wp-content/uploads/2024/09/Untitled_Artwork.jpg,eng-9888192,-0.1529,463638866,34,pittnews.com,news,The Pitt News,2024-09-10
8314324730,eng,False,2024-09-10,04:29:24,2024-09-10T04:29:24Z,2024-09-10T04:29:11Z,news,0.4471,http://roughdraftatlanta.com/2024/09/10/bill-crane-trump-harris-presidential-debate/,One Man's Opinion: high stakes debate,"The Keystone State continues to play an outsized role in the 2024 Presidential Election, and this week is the host site for the only debate between major party Presidential contenders, former ...","{'uri': ['bill_crane@roughdraftatlanta.com'], 'name': ['Bill Crane'], 'type': ['author'], 'isAgency': [False]}",https://roughdraftatlanta.com/wp-content/uploads/2024/07/Crane-Image.png,eng-9888611,0.0745,463638564,1,roughdraftatlanta.com,news,Rough Draft Atlanta,2024-09-10
8314296954,eng,False,2024-09-10,04:02:16,2024-09-10T04:02:16Z,2024-09-10T04:02:00Z,news,0.8431,https://ca.news.yahoo.com/former-project-2025-director-calls-032827546.html,Former Project 2025 Director Calls Conservative Plan 'Kennedy-esque' in First TV Interview Since Exit | Video,"Kaitlan Collins is preparing for Tuesday's presidential debate by getting some clarification on a likely topic of conversation: Project 2025.

Paul Dans, the former director of Project 2025, sat down ...",[],https://media.zenfs.com/en/thewrap.com/2c6d4cf89b6c28fd57ec2ddd501e4222,eng-9889831,-0.0588,463636936,1,ca.news.yahoo.com,news,Yahoo,2024-09-10
8314293195,eng,True,2024-09-10,03:58:20,2024-09-10T03:58:20Z,2024-09-10T03:56:50Z,news,0.0,https://www.ewn.co.za/2024/09/10/harris-and-trump-to-clash-as-america-awaits-next-twist,Harris and Trump to clash as America awaits next twist,"PHILADELPHIA - Kamala Harris and Donald Trump will clash in their first and possibly last televised debate Tuesday, in a potentially game-changing moment for the blockbuster 2024 US presidential ...","{'uri': ['agence_france_presse@ewn.co.za'], 'name': ['Agence France-Presse'], 'type': ['author'], 'isAgency': [True]}",https://media-cache.primedia-service.com/media/vcnnej3g/afp__20240909__36fn8zd__v1__highres__combousvotepoliticsharristrump.jpg?width=1200&height=900,,-0.051,463636700,1,ewn.co.za,news,EWN Traffic,2024-09-10
2024-09-480425173,eng,False,2024-09-10,03:57:08,2024-09-10T03:57:08Z,2024-09-10T03:56:58Z,news,0.0,https://badgerherald.com/news/campus/2024/09/09/morgridge-center-hosts-student-voting-events/,Morgridge Center hosts student voting events,"Morgridge Center for Public Service is hosting voter registration events this week at various campus event centers. The event centers include Union South, the Red Gym, Grainger Hall, Engineering Hall ...",[],https://badgerherald.com/wp-content/uploads/2024/09/US_1.jpg,,0.0196,463636628,1,badgerherald.com,news,The Badger Herald,2024-09-10
8314289737,eng,True,2024-09-10,03:52:48,2024-09-10T03:52:48Z,2024-09-10T03:52:24Z,news,0.0,https://www.adaderana.lk/news/101855/ec-orders-to-remove-candidate-stickers-on-vehicles-immediately,EC orders to remove candidate stickers on vehicles immediately,"The Election Commission has ordered the immediate removal of all stickers promoting presidential candidates from vehicles, stating that it is an offense under Section 74 of the Presidential Elections ...",[],https://adaderanaenglish.s3.amazonaws.com/1725940235-sticker-6.jpg,,-0.2314,463636368,1,adaderana.lk,news,Ada Derana,2024-09-10
8314289087,eng,False,2024-09-10,03:51:46,2024-09-10T03:51:46Z,2024-09-10T03:51:30Z,news,0.0,https://www.adaderana.lk/news.php?nid=101855,EC orders to remove candidate stickers on vehicles immediately,"The Election Commission has ordered the immediate removal of all stickers promoting presidential candidates from vehicles, stating that it is an offense under Section 74 of the Presidential Elections ...",[],https://adaderanaenglish.s3.amazonaws.com/1725940235-sticker-6.jpg,,-0.2314,463636306,1,adaderana.lk,news,Ada Derana,2024-09-10
8314277513,eng,False,2024-09-10,03:37:36,2024-09-10T03:37:36Z,2024-09-10T03:37:12Z,news,0.7961,https://www.thewrap.com/project-2025-trump-debate-paul-dans-kaitlan-collins-cnn/,Former Project 2025 Director Calls Conservative Plan 'Kennedy-esque' in First TV Interview Since Exit | Video,"""Trump's the greatest debater, bar none, of our time and the breaking news is: Trump has nothing to do with Project 2025,"" Paul Dans tells CNN's Kaitlan Collins

Kaitlan Collins is preparing for ...","{'uri': ['jd_knapp@thewrap.com'], 'name': ['Jd Knapp'], 'type': ['author'], 'isAgency': [False]}",https://www.thewrap.com/wp-content/uploads/2024/09/cnn-kaitlan-collins.jpg,eng-9889831,0.0039,463635456,1,thewrap.com,news,TheWrap,2024-09-10
2024-09-480415367,eng,False,2024-09-10,03:36:30,2024-09-10T03:36:30Z,2024-09-10T03:31:15Z,news,0.7255,https://exbulletin.com/politics/2839519/,Donald Trump-Kamala Harris debate: What the polls say before the Harris-Trump presidential debate,"The June 27 presidential debate between President Joe Biden and former President Donald Trump was arguably one of the most consequential in modern history, catalyzing Biden's withdrawal from the race ...",[],https://cdn.abcotvs.com/dip/images/15283605_kamala-trump-538-img.jpg?w=1600,eng-9888611,0.0824,463635390,1,exbulletin.com,news,ExBulletin,2024-09-10
2024-09-480406970,eng,True,2024-09-10,03:22:40,2024-09-10T03:22:40Z,2024-09-10T03:06:29Z,news,0.0,https://internewscast.com/news/kamala-harris-highlights-dmz-visit-on-policy-page-as-evidence-of-day-1-readiness/,Kamala Harris Highlights DMZ Visit on Policy Page as Evidence of Day 1 Readiness - Internewscast Journal,"Vice President Kamala Harris published a policy page on her official website Sunday promising she is ""ready to be Commander in Chief on day one,"" but she cited one of her most notorious foreign policy ...",[],https://internewscast.com/wp-content/uploads/2024/09/rewrite-this-title-Kamala-Harris-Policy-Page-Touts-DMZ-Visit.jpg,,0.302,463634560,1,internewscast.com,news,Internewscast Journal,2024-09-10
8314265411,eng,True,2024-09-10,03:22:12,2024-09-10T03:22:12Z,2024-09-10T03:21:23Z,news,0.0,https://matzav.com/trump-towers-nate-silvers-latest-forecast-has-trump-winning-every-single-swing-state-in-electoral-college-blowout/,TRUMP TOWERS: Nate Silver's Latest Forecast Has Trump Winning Every Single Swing State in Electoral College Blowout,"According to his latest 2024 presidential election forecast, polling pundit Nate Silver believes Donald Trump will defeat Kamala Harris in every battleground state for an electoral college ...",[],https://matzav.com/wp-content/uploads/2023/07/trump-4-scaled.jpg,,-0.051,463634532,1,matzav.com,news,matzav.com,2024-09-10
8314264491,eng,False,2024-09-10,03:21:31,2024-09-10T03:21:31Z,2024-09-10T03:20:12Z,news,0.9137,https://www.singaporelawwatch.sg/Headlines/bill-to-combat-digitally-manipulated-content-deepfakes-during-elections-tabled-in-parliament,"Bill to combat digitally manipulated content, deepfakes during elections tabled in Parliament","If it is passed, candidates can ask for review of content that has misrepresented them.

A new Bill will put in place measures to counter digitally manipulated content during elections including ...",[],https://www.singaporelawwatch.sg/Portals/0/EasyDNNnews/119350/240910_R6.jpg,eng-9887155,-0.1608,463634491,1,singaporelawwatch.sg,news,singaporelawwatch.sg,2024-09-10
8314264451,eng,False,2024-09-10,03:20:29,2024-09-10T03:20:29Z,2024-09-10T03:20:07Z,news,0.0,https://www.dallasnews.com/opinion/commentary/2024/09/09/podcast-beyond-immigration-talking-points-with-madeline-zavodny/,Podcast: Beyond immigration talking points with Madeline Zavodny,"Editor's note: Beyond Talking Points: An American Middle Podcast is a limited, 9-part series leading up to the 2024 presidential election brings the listener into the briefing room of presidential ...",[],https://dmn-dallas-news-prod.cdn.arcpublishing.com/resizer/v2/IPNBCIL5DBHZBPYA7KZ2VPQHUY.png?auth=e1d4a56348f5ad131a88164073337599ca01202fc1f3eb1ba270858d1b9463f7&height=467&width=830&smart=true&quality=80,,0.098,463634429,1,dallasnews.com,news,The Dallas Morning News,2024-09-10
8314259598,eng,False,2024-09-10,03:15:45,2024-09-10T03:15:45Z,2024-09-10T03:14:55Z,news,0.0,https://www.democraticunderground.com/100219438002,Explainer: the Russian influence operations targeting the 2024 US elections,"https://dfrlab.org/2024/09/06/how-doppelganger-and-other-russia-linked-operations-target-us-elections/

On September 4, 2024, the US Treasury Department announced that it had sanctioned ten Russian ...",[],,,0.098,463634145,1,democraticunderground.com,news,Democratic Underground,2024-09-10
8314257108,eng,True,2024-09-10,03:12:48,2024-09-10T03:12:48Z,2024-09-10T03:11:55Z,news,0.0,https://www.businesstimes.com.sg/international/harris-and-trump-clash-america-awaits-next-twist,Harris and Trump to clash as America awaits next twist,"KAMALA Harris and Donald Trump will clash in their first and possibly last televised debate Tuesday, in a potentially game-changing moment for the blockbuster 2024 US presidential election.

The ...",[],https://cassette.sphdigital.com.sg/image/businesstimes/9c28257a2ce495e82276693c5c2252c37023fed9563f1fb24a5996eccce64622,,-0.0275,463633968,1,businesstimes.com.sg,news,The Business Times,2024-09-10
8314255461,eng,False,2024-09-10,03:10:25,2024-09-10T03:10:25Z,2024-09-10T03:10:01Z,news,0.0,https://en.prothomalo.com/international/americas/ml2g4mtnuq,"Harris, Trump to clash as US awaits next twist","Kamala Harris and Donald Trump will clash in their first and possibly last televised debate Tuesday, in a potentially game-changing moment for the blockbuster 2024 US presidential election.

The ...","{'uri': ['agence_france_presse@en.prothomalo.com'], 'name': ['Agence France-Presse'], 'type': ['author'], 'isAgency': [False]}",https://images.prothomalo.com/prothomalo-english%2F2024-09-10%2Ftxomqwal%2Fprothomalo-bangla_2024-07_d8d3399c-32e0-4be9-ad6f-2ede4d08c152_trump%20kamala.jpg?w=1200&ar=40%3A21&auto=format%2Ccompress&ogImage=true&mode=crop&overlay=&overlay_position=bottom&overlay_width_pct=1,,0.2863,463633825,1,en.prothomalo.com,news,Prothomalo,2024-09-10
2024-09-480393483,eng,True,2024-09-10,02:55:59,2024-09-10T02:55:59Z,2024-09-10T01:13:51Z,news,0.0,https://www.ccenterdispatch.com/news/national/article_b20512ab-b48b-5b2b-8a08-b6c79e732877.html,Harris and Trump to clash as America awaits next twist,"Kamala Harris and Donald Trump will meet for the first time in person at the debate

Kamala Harris and Donald Trump will clash in their first and possibly last televised debate Tuesday, in a ...","{'uri': ['danny_kemp@ccenterdispatch.com'], 'name': ['Danny Kemp'], 'type': ['author'], 'isAgency': [False]}",https://bloximages.newyork1.vip.townnews.com/ccenterdispatch.com/content/tncms/assets/v3/editorial/b/a6/ba6c929c-378b-5896-930c-13aa2fcfb8fb/66dfac3f119fa.image.jpg?crop=341%2C341%2C85%2C0&resize=200%2C200&order=crop%2Cresize,,0.0588,463632959,1,ccenterdispatch.com,news,Clay Center Dispatch On-Line,2024-09-10
2024-09-480389801,eng,False,2024-09-10,02:46:33,2024-09-10T02:46:33Z,2024-09-10T01:13:51Z,news,0.6275,https://www.kulr8.com/news/national/harris-and-trump-to-clash-as-america-awaits-next-twist/article_9d52672b-9504-50d9-ba48-001e27954f42.html,Harris and Trump to clash as America awaits next twist,"Kamala Harris and Donald Trump will meet for the first time in person at the debate

Kamala Harris and Donald Trump will clash in their first and possibly last televised debate Tuesday, in a ...","{'uri': ['danny_kemp@kulr8.com'], 'name': ['Danny Kemp'], 'type': ['author'], 'isAgency': [False]}",https://bloximages.newyork1.vip.townnews.com/kulr8.com/content/tncms/assets/v3/editorial/f/93/f934759c-6123-5f9b-84a4-296914e36584/66dfabebc326e.image.jpg?crop=512%2C269%2C0%2C36&resize=438%2C230&order=crop%2Cresize,eng-9888611,0.0588,463632393,1,kulr8.com,news,KULR-8 Local News,2024-09-10
2024-09-480388948,eng,False,2024-09-10,02:45:04,2024-09-10T02:45:04Z,2024-09-10T01:13:51Z,news,0.6353,https://www.reformer.com/news/national/harris-and-trump-to-clash-as-america-awaits-next-twist/article_918a1944-3e66-57ed-a087-d6c4aa9d0b49.html,Harris and Trump to clash as America awaits next twist,"Kamala Harris and Donald Trump will meet for the first time in person at the debate

Kamala Harris and Donald Trump will clash in their first and possibly last televised debate Tuesday, in a ...","{'uri': ['danny_kemp@reformer.com'], 'name': ['Danny Kemp'], 'type': ['author'], 'isAgency': [False]}",https://bloximages.newyork1.vip.townnews.com/reformer.com/content/tncms/assets/v3/editorial/2/b7/2b7d93b9-a667-52c0-b3f8-6ba5cc5127a7/66dfabde919bb.image.jpg?crop=512%2C269%2C0%2C36&resize=438%2C230&order=crop%2Cresize,eng-9888611,0.0588,463632304,1,reformer.com,news,Brattleboro Reformer,2024-09-10
8314230404,eng,True,2024-09-10,02:39:37,2024-09-10T02:39:37Z,2024-09-10T02:35:56Z,news,0.0,https://www.geo.tv/latest/563470-harris-and-trump-to-clash-as-america-awaits-next-twist,Harris and Trump to clash as America awaits next twist,"Trump will try to box in Harris on issues like economy and immigration, but may also unleash more of racist insults

Kamala Harris and Donald Trump will clash in their first and possibly last ...",[],https://www.geo.tv/assets/uploads/updates/2024-09-10/l_563470_073405_updates.jpg,,-0.1373,463631977,1,geo.tv,news,GEO TV,2024-09-10
8314228824,eng,True,2024-09-10,02:33:58,2024-09-10T02:33:58Z,2024-09-10T02:33:16Z,news,0.0,https://www.fox41yakima.com/harris-and-trump-to-clash-as-america-awaits-next-twist/,Harris and Trump to clash as America awaits next twist | Fox 11 Tri Cities Fox 41 Yakima,"Kamala Harris and Donald Trump will clash in their first and possibly last televised debate Tuesday, in a potentially game-changing moment for the blockbuster 2024 US presidential election.

The ...","{'uri': ['danny_kemp@fox41yakima.com'], 'name': ['Danny Kemp'], 'type': ['author'], 'isAgency': [False]}",https://www.fox41yakima.com/wp-content/uploads/2024/09/66dfabbfc33ceimage_.jpg,,-0.0275,463631638,1,fox41yakima.com,news,FOX 11 41 Tri Cities Yakima,2024-09-10
2024-09-480383306,eng,True,2024-09-10,02:33:11,2024-09-10T02:33:11Z,2024-09-10T01:13:51Z,news,0.0,https://www.annistonstar.com/news/nation_world/harris-and-trump-to-clash-as-america-awaits-next-twist/article_d1b4638a-e4db-5317-a60d-4ecf0b984086.html,Harris and Trump to clash as America awaits next twist,"Kamala Harris and Donald Trump will meet for the first time in person at the debate

Kamala Harris and Donald Trump will clash in their first and possibly last televised debate Tuesday, in a ...","{'uri': ['danny_kemp@annistonstar.com'], 'name': ['Danny Kemp'], 'type': ['author'], 'isAgency': [False]}",https://bloximages.chicago2.vip.townnews.com/annistonstar.com/content/tncms/assets/v3/editorial/3/c1/3c128a63-eb51-5266-863b-b6ed4486af40/66dfabf3a393a.image.jpg?crop=512%2C269%2C0%2C36&resize=438%2C230&order=crop%2Cresize,,0.2235,463631591,1,annistonstar.com,news,The Anniston Star,2024-09-10
8314228092,eng,True,2024-09-10,02:33:05,2024-09-10T02:33:05Z,2024-09-10T02:31:59Z,news,0.0,https://www.messenger-inquirer.com/news/national/harris-and-trump-to-clash-as-america-awaits-next-twist/article_fefb2581-499a-581d-8da9-83c6146fde5c.html,Harris and Trump to clash as America awaits next twist,"Kamala Harris and Donald Trump will meet for the first time in person at the debate

Kamala Harris and Donald Trump will clash in their first and possibly last televised debate Tuesday, in a ...","{'uri': ['danny_kemp@messenger-inquirer.com'], 'name': ['Danny Kemp'], 'type': ['author'], 'isAgency': [False]}",https://bloximages.chicago2.vip.townnews.com/messenger-inquirer.com/content/tncms/assets/v3/editorial/9/4c/94c4fc39-11f2-50e8-8a4c-2ccd57ac5656/66dfac85a28d1.image.jpg?crop=512%2C269%2C0%2C36&resize=438%2C230&order=crop%2Cresize,,0.302,463631585,1,messenger-inquirer.com,news,Owensboro Messenger-Inquirer,2024-09-10
2024-09-480383125,eng,True,2024-09-10,02:32:39,2024-09-10T02:32:39Z,2024-09-10T01:13:51Z,news,0.0,https://www.djournal.com/news/national/harris-and-trump-to-clash-as-america-awaits-next-twist/article_0463606b-e3ef-5a67-9782-9668d54d9ffc.html,Harris and Trump to clash as America awaits next twist,"Kamala Harris and Donald Trump will meet for the first time in person at the debate

Kamala Harris and Donald Trump will clash in their first and possibly last televised debate Tuesday, in a ...","{'uri': ['danny_kemp@djournal.com'], 'name': ['Danny Kemp'], 'type': ['author'], 'isAgency': [False]}",https://bloximages.newyork1.vip.townnews.com/djournal.com/content/tncms/assets/v3/editorial/3/07/3075d1ea-6701-57e1-a818-a5f15d6f37da/66dfac3beea53.image.jpg?crop=512%2C269%2C0%2C36&resize=438%2C230&order=crop%2Cresize,,0.1686,463631559,1,djournal.com,news,Daily Journal,2024-09-10
8314228209,eng,True,2024-09-10,02:32:33,2024-09-10T02:32:33Z,2024-09-10T02:32:10Z,news,0.0,https://www.fox28spokane.com/harris-and-trump-to-clash-as-america-awaits-next-twist/,Harris and Trump to clash as America awaits next twist | FOX 28 Spokane,"Kamala Harris and Donald Trump will clash in their first and possibly last televised debate Tuesday, in a potentially game-changing moment for the blockbuster 2024 US presidential election.

The ...","{'uri': ['danny_kemp@fox28spokane.com'], 'name': ['Danny Kemp'], 'type': ['author'], 'isAgency': [False]}",https://www.fox28spokane.com/wp-content/uploads/2024/09/66dfabac4845cimage_.jpg,,-0.0275,463631553,1,fox28spokane.com,news,FOX 28 Spokane,2024-09-10
2024-09-480382371,eng,False,2024-09-10,02:31:23,2024-09-10T02:31:23Z,2024-09-10T01:13:51Z,news,0.0,https://www.mycouriertribune.com/news/national_news/harris-and-trump-to-clash-as-america-awaits-next-twist/article_56035c16-9e91-5dec-b077-e7dffa6da804.html,Harris and Trump to clash as America awaits next twist,"Kamala Harris and Donald Trump will meet for the first time in person at the debate

Kamala Harris and Donald Trump will clash in their first and possibly last televised debate Tuesday, in a ...","{'uri': ['danny_kemp@mycouriertribune.com'], 'name': ['Danny Kemp'], 'type': ['author'], 'isAgency': [False]}",https://bloximages.newyork1.vip.townnews.com/mycouriertribune.com/content/tncms/assets/v3/editorial/b/5e/b5e0a17b-a521-53cf-8159-cc9bf04223bf/66dfabf258e8d.image.jpg?crop=512%2C269%2C0%2C36&resize=438%2C230&order=crop%2Cresize,,0.098,463631483,1,mycouriertribune.com,news,Courier-Tribune,2024-09-10
