uri,lang,isDuplicate,date,time,dateTime,dateTimePub,dataType,sim,url,title,body,authors,image,eventUri,sentiment,wgt,relevance,source.uri,source.dataType,source.title,feed date
8289213409,eng,False,2024-08-24,05:33:01,2024-08-24T05:33:01Z,2024-08-24T05:31:18Z,news,0.749,https://www.ncregister.com/cna/cna-20240823-rfk-jr-suspends-campaign,"Robert F. Kennedy Jr. Suspends Campaign, Urges Voters to Elect Donald Trump","Kennedy said the Democratic Party has 'departed so dramatically on the core values that I grew up with.'

Independent candidate Robert F. Kennedy, Jr. suspended his 2024 presidential campaign Friday ...",[],https://publisher-ncreg.s3.us-east-2.amazonaws.com/pb-ncregister/swp/hv9hms/media/2024082323088_c7a449853d484b4511d3e58184e66883e1efbe124bfb664bdfc50defdcf2b707.jpg,eng-9841987,0.2784,462173581,1,ncregister.com,news,National Catholic Register,2024-08-24
8289209943,eng,False,2024-08-24,05:27:49,2024-08-24T05:27:49Z,2024-08-24T05:26:59Z,news,0.4706,https://www.foxnews.com/politics/2024-showdown-what-happens-next-kamala-harris-donald-trump-face-off,2024 showdown: What happens next in the Kamala Harris-Donald Trump face-off,"Former President Trump speaks in Las Vegas after RFK, Jr. suspends his campaign and endorses him.

Vice President Kamala Harris, urged her supporters to ""get out there, let's fight for it,"" as she ...","{'uri': ['paul_steinhauser@foxnews.com'], 'name': ['Paul Steinhauser'], 'type': ['author'], 'isAgency': [False]}",https://a57.foxnews.com/static.foxnews.com/foxnews.com/content/uploads/2024/08/1024/512/Capture.png?ve=1&tl=1,eng-9833061,0.0431,462173269,1,foxnews.com,news,Fox News,2024-08-24
2024-08-464042049,eng,False,2024-08-24,04:28:50,2024-08-24T04:28:50Z,2024-08-24T03:59:07Z,news,0.0,https://pittnews.com/article/189010/news/a-students-guide-to-registering-and-voting-in-the-2024-presidential-election/,A student's guide to registering and voting in the 2024 presidential election,"For many college students, voting in the 2024 presidential election will be their first experience at the voting booth. To be ready for the Nov. 5 election, students must register to vote by Oct. ...","{'uri': ['emma_hannan@pittnews.com'], 'name': ['Emma Hannan'], 'type': ['author'], 'isAgency': [False]}",https://pittnews.com/wp-content/uploads/2024/08/N_PrepForNovElections_AE.png,,0.2157,462169730,1,pittnews.com,news,The Pitt News,2024-08-24
8289146168,eng,False,2024-08-24,04:11:23,2024-08-24T04:11:23Z,2024-08-24T04:09:45Z,news,0.0,https://english.elpais.com/usa/elections/2024-08-24/project-2025-the-conservative-roadmap-to-transform-america-with-donald-trump-in-office.html,"Project 2025, the conservative roadmap to transform America with Donald Trump in office",Project 2025 has become a key talking point within the United States presidential election. Although Republican candidate Donald Trump has distanced himself from the document (which promotes a series ...,"{'uri': ['alonso_martinez@english.elpais.com'], 'name': ['Alonso Martínez'], 'type': ['author'], 'isAgency': [False]}",https://imagenes.elpais.com/resizer/v2/R7ZWAV2HW5CCPK7W2EA2TOKNLE.jpg?auth=9cbbb192fcea2f4df4304b69a5e98b8b6b8b03ae75ecb0bf6db99dcd614e4b58&width=1200,,0.4196,462168683,1,english.elpais.com,news,EL PAÍS,2024-08-24
8289139098,eng,False,2024-08-24,04:04:11,2024-08-24T04:04:11Z,2024-08-24T04:02:10Z,news,0.6902,https://exbulletin.com/politics/2827031/,"Robert F. Kennedy Jr. suspends 2024 White House bid, endorses Donald Trump - ExBulletin","Independent U.S. presidential candidate Robert F. Kennedy announced Friday that he is ending his campaign for the 2024 presidential election, pledging his support for Republican candidate Donald ...",[],https://cdnuploads.aa.com.tr/uploads/Contents/2024/08/23/thumbs_b_c_640b1d5c4d46b5f000368fa302bc9604.jpg?v=233157,eng-9841987,0.0667,462168251,1,exbulletin.com,news,ExBulletin,2024-08-24
8289127563,eng,False,2024-08-24,03:47:28,2024-08-24T03:47:28Z,2024-08-24T03:45:32Z,news,0.0,https://gazette.com/news/wex/harrison-butker-urges-jd-vance-to-bring-trump-back-in-line-on-abortion/article_859269fc-b5c1-5501-9059-53dd3e5f2763.html,Harrison Butker urges JD Vance to bring Trump 'back in line' on abortion,"Kansas City Chiefs kicker Harrison Butker urged Sen. J.D. Vance (R-OH) to bring former President Donald Trump ""back in line"" with a platform that would endorse a stricter stance on abortion.

Butker ...","{'uri': ['washington_examiner@gazette.com'], 'name': ['Washington Examiner'], 'type': ['author'], 'isAgency': [False]}",https://bloximages.newyork1.vip.townnews.com/gazette.com/content/tncms/custom/image/3f755dae-418c-11e8-a244-53852639d709.png?crop=235%2C235%2C1%2C0&resize=200%2C200&order=crop%2Cresize,,0.1216,462167248,1,gazette.com,news,Colorado Springs Gazette,2024-08-24
8288960041,eng,True,2024-08-24,03:46:52,2024-08-24T03:46:52Z,2024-08-23T23:41:26Z,news,0.0,https://www.yahoo.com/news/rfk-jr-jill-stein-cornell-224915925.html,"Jill Stein, Cornell West, Chase Oliver: Who else is running for president in 2024?","Kamala Harris and Donald Trump are the two major party candidates in the 2024 presidential election, but dozens of other people are also running.

None is on a realistic path to the White House, but ...",[],https://media.zenfs.com/en/bbc_us_articles_995/c1896a9d79e74c3b4fa42e273d8171f9,,-0.0353,462167212,1,yahoo.com,news,Yahoo,2024-08-24
2024-08-464022223,eng,False,2024-08-24,03:46:31,2024-08-24T03:46:31Z,2024-08-23T16:47:01Z,news,0.8078,https://www.yahoo.com/news/barron-trump-york-college-not-164701894.html,"Barron Trump at a New York college, not UPenn or Georgetown, breaking family tradition","Barron Trump, the sole child of Donald and Melania Trump, picked a college in New York and starts fall 2024 classes soon, Donald Trump confirmed in an Aug. 20 New York Post story: ""He's all set in a ...","{'uri': ['jennifer_sangalang@yahoo.com'], 'name': ['Jennifer Sangalang'], 'type': ['author'], 'isAgency': [False]}",https://media.zenfs.com/en/palm_beach_post_natl_articles_437/0fdfd7d0ac314e0eb747648dbfabb125,eng-9830470,0.1451,462167191,1,yahoo.com,news,Yahoo,2024-08-24
2024-08-464017818,eng,True,2024-08-24,03:37:37,2024-08-24T03:37:37Z,2024-08-24T03:22:58Z,news,0.0,https://internewscast.com/news/bill-maher-has-trouble-grasping-charli-xcxs-brat-support-for-kamala-harris-it-reminds-me-of-trump/,"Bill Maher Has Trouble Grasping Charli XCX's 'Brat' Support for Kamala Harris: ""It Reminds Me of Trump"" - Internewscast Journal","After a month-long hiatus, Bill Maher is catching up with today's internet slang... in real time.

On Friday's episode of Real Time with Bill Maher, the host attempted to understand the Brat ...",[],https://internewscast.com/wp-content/uploads/2024/01/ic_launcher.png,,0.1451,462166657,1,internewscast.com,news,Internewscast Journal,2024-08-24
8289117763,eng,True,2024-08-24,03:34:47,2024-08-24T03:34:47Z,2024-08-24T03:33:31Z,news,0.0,https://newsfirst.lk/2024/08/24/election-commission-announces-opportunity-to-replace-deceased-independent-presidential-candidate,Election Commission Announces Opportunity to Replace Deceased Independent Presidential Candidate,"COLOMBO (News 1st): The National Election Commission says that there is an opportunity to nominate another candidate in place of the deceased independent presidential candidate, Muhammad Ilyas, for ...",[],https://cdn.newsfirst.lk/english-uploads/2024/08/Muhammad Ilyas-764908_850x460-765019_850x460.jpg,,-0.0902,462166487,1,newsfirst.lk,news,newsfirst.lk,2024-08-24
8289116927,eng,True,2024-08-24,03:33:07,2024-08-24T03:33:07Z,2024-08-24T03:32:25Z,news,0.0,https://dnyuz.com/2024/08/23/bill-maher-struggles-to-understand-charli-xcxs-brat-kamala-harris-endorsement-it-sounds-like-trump/,"Bill Maher Struggles To Understand Charli XCX's 'Brat' Kamala Harris Endorsement: ""It Sounds Like Trump""","On Friday's episode of Real Time with Bill Maher, the host attempted to understand the Brat phenomenon and Charli XCX's endorsement of Vice President Kamala Harris as he spoke with CNN anchor Kaitlan ...",[],https://dnyuz.com/wp-content/uploads/2024/08/Bill-Maher-Struggles-To-Understand-Charli-XCXs-'Brat-Kamala-Harris.jpg,,0.1294,462166387,1,dnyuz.com,news,DNyuz,2024-08-24
8289114338,eng,False,2024-08-24,03:32:49,2024-08-24T03:32:49Z,2024-08-24T03:28:14Z,news,0.0,https://ceylontoday.lk/2024/08/24/ec-grapples-with-rising-complaints-ahead-of-presidential-polls/,EC Grapples with Rising Complaints Ahead of Presidential Polls - Ceylon Today,"In the week following the acceptance of nominations for the presidential election, by the Election Commission of Sri Lanka (15 to 22 August), the Election Commission has received over 747 complaints ...","{'uri': ['buwanaka_perera@ceylontoday.lk'], 'name': ['Buwanaka Perera'], 'type': ['author'], 'isAgency': [False]}",https://ceylontoday.lk/wp-content/uploads/2024/08/Chairman-of-the-Election-Commission-of-Sri-Lanka-R.-M.-A.-L.-Rathnayake-centre-and-members-Prof.-Lakshman-Dissanayake-left-and-M.-A.-P.-C.-Perera-right.jpg,,-0.5843,462166369,1,ceylontoday.lk,news,CeylonToday,2024-08-24
8289111528,eng,False,2024-08-24,03:25:06,2024-08-24T03:25:06Z,2024-08-24T03:24:15Z,news,0.6627,https://wlos.com/news/local/rfk-jr-suspends-2024-presidential-campaign-local-political-analyst-reacts-robert-f-kennedy-election-former-president-donald-trump-vice-president-kamala-harris,RFK Jr. suspends 2024 presidential campaign: local political analyst reacts,"ASHEVILLE, N.C. (WLOS) -- Independent candidate Robert F. Kennedy Jr. announced on Friday, Aug. 23 that he is suspending his campaign for the 2024 presidential election.

In his announcement, he said ...","{'uri': ['marc_liverman@wlos.com'], 'name': ['Marc Liverman'], 'type': ['author'], 'isAgency': [False]}",https://wlos.com/resources/media/506c3f84-17dd-441a-8085-f7f47fbaf9a9-large16x9_1011RFKLLPKG.movframe6449.png,eng-9843619,0.1137,462165906,1,wlos.com,news,WLOS,2024-08-24
2024-08-464002636,eng,False,2024-08-24,03:06:04,2024-08-24T03:06:04Z,2024-08-24T03:05:57Z,news,0.0,https://english.newsfirst.lk/2024/8/24/election-commission-announces-opportunity-to-replace-deceased-independent-presidential-candidate,Election Commission Announces Opportunity to Replace Deceased Independent Presidential Candidate,"COLOMBO (News 1st): The National Election Commission says that there is an opportunity to nominate another candidate in place of the deceased independent presidential candidate, Muhammad Ilyas, for ...",[],https://cdn.newsfirst.lk/english-uploads/2024/08/Muhammad Ilyas-764908_850x460-765019_850x460.jpg,,-0.0275,462164764,1,english.newsfirst.lk,news,english.newsfirst.lk,2024-08-24
8289094781,eng,False,2024-08-24,03:01:29,2024-08-24T03:01:29Z,2024-08-24T03:00:23Z,news,0.5059,https://deadline.com/2024/08/bill-maher-struggles-understand-charli-xcx-brat-kamala-harris-endorsement-sounds-like-trump-1236049514/,"Bill Maher Struggles To Understand Charli XCX's 'Brat' Kamala Harris Endorsement: ""It Sounds Like Trump""","On Friday's episode of Real Time with Bill Maher, the host attempted to understand the Brat phenomenon and Charli XCX's endorsement of Vice President Kamala Harris as he spoke with CNN anchor Kaitlan ...","{'uri': ['glenn_garner@deadline.com'], 'name': ['Glenn Garner'], 'type': ['author'], 'isAgency': [False]}",https://deadline.com/wp-content/uploads/2024/08/Kaitlan-Collins-Bill-Maher-Real-TIme.jpg?w=1024,eng-9839042,0.1294,462164489,1,deadline.com,news,Deadline,2024-08-24
8289084325,eng,False,2024-08-24,02:45:18,2024-08-24T02:45:18Z,2024-08-24T02:44:17Z,news,0.0,https://www.washingtonexaminer.com/news/campaigns/presidential/3133427/harrison-butker-urges-jd-vance-bring-trump-back-in-line-on-abortion/,Harrison Butker urges JD Vance to bring Trump 'back in line' on abortion - Washington Examiner,"Butker came to political prominence when he gave a commencement speech at Benedictine College advocating women to be homemakers, after which many accused him of being sexist.

Butker reposted Trump's ...","{'uri': ['ross_o_keefe@washingtonexaminer.com'], 'name': [""Ross O'Keefe""], 'type': ['author'], 'isAgency': [False]}",https://www.washingtonexaminer.com/wp-content/uploads/2024/08/Butker-vance-scaled.webp,,0.0588,462163518,1,washingtonexaminer.com,news,Washington Examiner,2024-08-24
8289062719,eng,False,2024-08-24,02:15:43,2024-08-24T02:15:43Z,2024-08-24T02:14:26Z,news,0.0,https://nybreaking.com/in-the-eyes-of-the-faithful-kamalas-gone-from-useless-vp-to-wonder-woman-but-what-shed-do-in-power-is-still-a-mystery/,"In The Eyes Of The Faithful, Kamala's Gone From Useless VP To Wonder Woman. But What She'd Do In Power Is Still A Mystery - Ny Breaking News","Thirty-six people were shot, seven of whom were killed, in Chicago during the four days that Democrats gathered in the Windy City to crown Queen Kamala as their last-minute candidate for the 2024 ...",[],https://nybreaking.com/wp-content/uploads/2024/08/In-the-eyes-of-the-faithful-Kamalas-gone-from-useless.jpeg,,-0.1843,462161743,1,nybreaking.com,news,NY Breaking News,2024-08-24
8289044648,eng,True,2024-08-24,01:47:24,2024-08-24T01:47:24Z,2024-08-24T01:44:57Z,news,0.0,https://www.thewrap.com/stacey-abrams-law-and-order-rudy-giuliani-hasan-minhaj-interview/,'Law & Order' Superfan Stacey Abrams Forgot Rudy Giuliani's Season 11 Cameo Because She's Too Used to Ignoring Him | Video,"The Georgia politician and voting rights activist joins Hasan Minhaj for a game of ""Stacey Abrams, Human IMDb?""

At the top of a wide-ranging interview on the podcast ""Hasan Minhaj Doesn't Know,"" ...","{'uri': ['benjamin_lindsay@thewrap.com'], 'name': ['Benjamin Lindsay'], 'type': ['author'], 'isAgency': [False]}",https://www.thewrap.com/wp-content/uploads/2024/08/Stacey-Abrams.jpeg,,0.051,462160044,1,thewrap.com,news,TheWrap,2024-08-24
8289045272,eng,False,2024-08-24,01:47:05,2024-08-24T01:47:05Z,2024-08-24T01:46:06Z,news,0.0,https://www.econotimes.com/Fox-News-Shocks-Viewers-with-Mass-GOP-Endorsement-for-Kamala-Harris-Declaring-Donald-Trump-Unfit-1684945,"Fox News Shocks Viewers with Mass GOP Endorsement for Kamala Harris, Declaring Donald Trump 'Unfit' - EconoTimes","Fox News surprises viewers by publishing a mass GOP endorsement for Kamala Harris, calling Donald Trump

Fox News has published a mass endorsement from a group of prominent Republicans backing Vice ...",[],https://f1.econotimes.com/2024/08/4ibrs47rr4_th_1024x0.jpg,,0.4275,462160025,1,econotimes.com,news,EconoTimes,2024-08-24
8289040154,eng,False,2024-08-24,01:40:42,2024-08-24T01:40:42Z,2024-08-24T01:38:30Z,news,0.0,https://ca.news.yahoo.com/law-order-superfan-stacey-abrams-013151221.html,'Law & Order' Superfan Stacey Abrams Forgot Rudy Giuliani's Season 11 Cameo Because She's Too Used to Ignoring Him | Video,"At the top of a wide-ranging interview on the podcast ""Hasan Minhaj Doesn't Know,"" Stacey Abrams' superfan knowledge was put to the test Friday with the host grilling her on trivia for ""Law & Order,"" ...",[],https://media.zenfs.com/en/thewrap.com/1d12778ebfd186f760cda9196baa894e,,0.051,462159642,1,ca.news.yahoo.com,news,Yahoo,2024-08-24
2024-08-463964890,eng,False,2024-08-24,01:25:40,2024-08-24T01:25:40Z,2024-08-23T11:30:20Z,news,0.5373,https://colombogazette.com/2024/08/23/president-says-he-took-the-responsibility-as-a-single-mp/,President says he took the responsibility as a single MP,"President Ranil Wickremesinghe says he took the responsibility to lead the country as a single MP from his party.

The President said that he and his Government was able to created an environment ...",[],http://colombogazette.com/wp-content/uploads/2024/08/WhatsApp-Image-2024-08-24-at-03.51.23.jpeg,eng-9838275,0.1373,462158740,1,colombogazette.com,news,Colombo Gazette,2024-08-24
8289023643,eng,False,2024-08-24,01:11:47,2024-08-24T01:11:47Z,2024-08-24T01:11:04Z,news,0.0,https://techbullion.com/dealing-with-election-anxiety-a-guide-to-finding-calm-in-uncertain-times/,Dealing with Election Anxiety: A Guide to Finding Calm in Uncertain Times,"As the election season draws near, many of us find ourselves experiencing heightened levels of stress and anxiety. The uncertainty surrounding the outcome, the intense media coverage, and the ...","{'uri': ['angela_scott_briggs@techbullion.com'], 'name': ['Angela Scott-Briggs'], 'type': ['author'], 'isAgency': [False]}",https://techbullion.com/wp-content/uploads/2024/08/Dealing-with-Election-Anxiety-A-Guide-to-Finding-Calm-in-Uncertain-Times.jpg,,-0.2,462157907,1,techbullion.com,news,TechBullion,2024-08-24
2024-08-463960247,eng,False,2024-08-24,01:09:53,2024-08-24T01:09:53Z,2024-08-23T23:33:13Z,news,0.5098,https://www.aol.com/rfk-jr-jill-stein-cornell-162329443.html,"Jill Stein, Cornell West, Chase Oliver: Who else is running for president in 2024?","Jill Stein, Cornell West, Chase Oliver: Who else is running for president in 2024?

Bernd Debusmann Jr and Sam Cabral - BBC News, Washington DC

August 24, 2024 at 1:33 AM

Kamala Harris and Donald ...","{'uri': ['sam_cabral@aol.com'], 'name': ['Sam Cabral'], 'type': ['author'], 'isAgency': [False]}",https://media.zenfs.com/en/aol_bbc_articles_618/c1896a9d79e74c3b4fa42e273d8171f9,eng-9837160,-0.0118,462157793,1,aol.com,news,Aol,2024-08-24
8289005165,eng,True,2024-08-24,00:41:00,2024-08-24T00:41:00Z,2024-08-24T00:40:04Z,news,0.5373,http://colombogazette.com/2024/08/23/president-says-he-took-the-responsibility-as-a-single-mp/,President says he took the responsibility as a single MP,"President Ranil Wickremesinghe says he took the responsibility to lead the country as a single MP from his party.

The President said that he and his Government was able to created an environment ...",[],http://colombogazette.com/wp-content/uploads/2024/08/WhatsApp-Image-2024-08-24-at-03.51.23.jpeg,,0.0745,462156060,1,colombogazette.com,news,Colombo Gazette,2024-08-24
8288958526,eng,False,2024-08-23,23:50:38,2024-08-23T23:50:38Z,2024-08-23T23:38:59Z,news,0.5059,https://ca.news.yahoo.com/rfk-jr-jill-stein-cornell-224915925.html,"Jill Stein, Cornell West, Chase Oliver: Who else is running for president in 2024?","Kamala Harris and Donald Trump are the two major party candidates in the 2024 presidential election, but dozens of other people are also running.

None is on a realistic path to the White House, but ...",[],https://media.zenfs.com/en/bbc_us_articles_995/c1896a9d79e74c3b4fa42e273d8171f9,eng-9837160,-0.0353,462153038,1,ca.news.yahoo.com,news,Yahoo,2024-08-24
8288953356,eng,False,2024-08-23,23:33:18,2024-08-23T23:33:18Z,2024-08-23T23:31:27Z,news,0.5882,https://www.freedomsphoenix.com/News/367404-2024-08-23-must-watch-rfk-jr-drops-reality-mic-on-dems-suspends.htm,"Must Watch: RFK Jr Drops 'Reality' Mic On Dems, Suspends Campaign...","The 2024 presidential election race is about to take its next unexpected turn...

""Democrats have become the party of war, censorship, corruption, big pharma, big tech, big ag, and big money wanting ...","{'uri': ['freedomsphoenix_readerfour@freedomsphoenix.com'], 'name': ['Freedomsphoenix Readerfour'], 'type': ['author'], 'isAgency': [False]}",https://www.freedomsphoenix.com/Uploads/Graphics/533-0823163008-ap24122863009685.jpg,eng-9843186,-0.0588,462151998,1,freedomsphoenix.com,news,freedomsphoenix.com,2024-08-24
2024-08-463920900,eng,True,2024-08-23,23:26:00,2024-08-23T23:26:00Z,2024-08-23T21:20:02Z,news,0.0,https://www.newsobserver.com/entertainment/article291391820.html,Internet Says JD Vance's 'Small Talk' With Donut Shop Workers Reminds Them of 'The Office' Skit,The Ohio senator has been a polarizing figure since Donald Trump selected him as his running mate for the 2024 presidential election. And one of his latest press appearances once again had people ...,"{'uri': ['carly_silva@newsobserver.com'], 'name': ['Carly Silva'], 'type': ['author'], 'isAgency': [False]}",https://www.mcclatchy-wires.com/incoming/pygs17/picture291391335/alternates/LANDSCAPE_1140/d487ff55-e821-4fcb-a730-af171dd2bac8,,0.0353,462151560,1,newsobserver.com,news,The News&Observer,2024-08-24
8288936453,eng,False,2024-08-23,23:06:57,2024-08-23T23:06:57Z,2024-08-23T23:06:25Z,news,0.7608,https://thenewamerican.com/us/judge-gives-rfk-green-light-to-sue-biden-admin-over-censorship/,Judge Gives RFK Green Light to Sue Biden Admin Over Censorship,"A federal judge ruled Tuesday that Robert F. Kennedy, Jr.'s censorship lawsuit against the Biden administration may proceed.

""The Court finds that Kennedy is likely to succeed on his claim that ...","{'uri': ['michael_tennant@thenewamerican.com'], 'name': ['Michael Tennant'], 'type': ['author'], 'isAgency': [False]}",https://thenewamerican.com/assets/sites/2/Censored-computer-6.23.22.jpg,eng-9839534,-0.1294,462150417,1,thenewamerican.com,news,The New American,2024-08-24
8288924755,eng,False,2024-08-23,22:49:59,2024-08-23T22:49:59Z,2024-08-23T22:49:15Z,news,0.6353,https://nypost.com/2024/08/23/sports/the-non-ayahuasca-ritual-aaron-rodgers-uses-to-ground-himself/,The non-ayahuasca ritual Jets' Aaron Rodgers uses to 'ground' himself,"Aaron Rodgers' experiences with ayahuasca have been well documented, but the Jets' quarterback revealed in an interview with Haute Time magazine that he has also used hapé -- which the outlet ...",[],https://nypost.com/wp-content/uploads/sites/2/2024/08/newspress-collage-x586rllhf-1724452074350.jpg?quality=75&strip=all&1724437700&w=1024,eng-9837099,0.2706,462149399,1,nypost.com,news,New York Post,2024-08-24
8288921038,eng,False,2024-08-23,22:45:37,2024-08-23T22:45:37Z,2024-08-23T22:43:53Z,news,0.0,https://www.freedomsphoenix.com/News/367394-2024-08-23-america-39-s-frontier-fund-the-venture-capital-firm-with.htm,America's Frontier Fund: The Venture Capital Firm with Ties to Peter Thiel and Eric Schmidt,"America's Frontier Fund: The Venture Capital Firm with Ties to Peter Thiel and Eric Schmidt

Americans are increasingly becoming aware of the fact that the secretive Bilderberg Group is funding both ...","{'uri': ['freedomsphoenix_readerfour@freedomsphoenix.com'], 'name': ['Freedomsphoenix Readerfour'], 'type': ['author'], 'isAgency': [False]}",https://www.freedomsphoenix.com/Uploads/Graphics/533-0823154108-thiel-schmidt-1024x545.jpg,,0.3412,462149137,1,freedomsphoenix.com,news,freedomsphoenix.com,2024-08-24
8288919411,eng,False,2024-08-23,22:42:41,2024-08-23T22:42:41Z,2024-08-23T22:41:42Z,news,0.7451,https://www.catholicnewsagency.com/news/258901/robert-f-kennedy-jr-suspends-campaign-urges-voters-to-elect-donald-trump,"Robert F. Kennedy Jr. suspends campaign, urges voters to elect Donald Trump","Independent candidate Robert F. Kennedy, Jr. suspended his 2024 presidential campaign Friday afternoon and threw his support behind former President Donald Trump, the Republican nominee.

Kennedy -- ...",[],https://www.catholicnewsagency.com/storage/image/gettyimages-2167258349.jpg?jpg,eng-9841987,0.2471,462148961,1,catholicnewsagency.com,news,Catholic News Agency,2024-08-24
2024-08-463899103,eng,False,2024-08-23,22:36:03,2024-08-23T22:36:03Z,2024-08-23T22:06:57Z,news,0.549,https://conservativeangle.com/must-watch-rfk-exposes-dnc-corruption-suspends-campaign-backs-trump-in-battleground-states/,"Must Watch: RFK Exposes DNC Corruption, Suspends Campaign, Backs Trump In Battleground States","The 2024 presidential election race is about to take its next unexpected turn...

""Democrats have become the party of war, censorship, corruption, big pharma, big tech, big ag, and big money wanting ...",[],,eng-9843186,0.0353,462148563,1,conservativeangle.com,news,Brigitte Gabriel,2024-08-24
2024-08-463889286,eng,True,2024-08-23,22:19:30,2024-08-23T22:19:30Z,2024-08-23T21:20:02Z,news,0.0,https://www.miamiherald.com/entertainment/article291391820.html,Internet Says JD Vance's 'Small Talk' With Donut Shop Workers Reminds Them of 'The Office' Skit,The Ohio senator has been a polarizing figure since Donald Trump selected him as his running mate for the 2024 presidential election. And one of his latest press appearances once again had people ...,"{'uri': ['carly_silva@miamiherald.com'], 'name': ['Carly Silva'], 'type': ['author'], 'isAgency': [False]}",https://www.mcclatchy-wires.com/incoming/pygs17/picture291391335/alternates/LANDSCAPE_1140/d487ff55-e821-4fcb-a730-af171dd2bac8,,0.0353,462147570,1,miamiherald.com,news,Miami Herald,2024-08-24
8288900386,eng,False,2024-08-23,22:18:27,2024-08-23T22:18:27Z,2024-08-23T22:17:14Z,news,0.0,https://www.oann.com/video/oan-contribution/attorney-pushes-for-election-integrity-ahead-of-2024-election/,Attorney Pushes For Election Integrity Ahead Of 2024 Election,"The 2024 presidential election is expected to be highly significant. Attorney Mike Yoder, a guest on Alicia Summers' show, is focused on restoring election integrity before November 5th. He discusses ...",[],https://www.oann.com/wp-content/uploads/2024/08/GettyImages-1412512137.webp,,-0.0745,462147507,1,oann.com,news,One America News Network,2024-08-24
2024-08-463887625,eng,True,2024-08-23,22:15:25,2024-08-23T22:15:25Z,2024-08-23T21:20:02Z,news,0.0,https://www.bradenton.com/entertainment/article291391820.html,Internet Says JD Vance's 'Small Talk' With Donut Shop Workers Reminds Them of 'The Office' Skit,The Ohio senator has been a polarizing figure since Donald Trump selected him as his running mate for the 2024 presidential election. And one of his latest press appearances once again had people ...,"{'uri': ['carly_silva@bradenton.com'], 'name': ['Carly Silva'], 'type': ['author'], 'isAgency': [False]}",https://www.mcclatchy-wires.com/incoming/pygs17/picture291391335/alternates/LANDSCAPE_1140/d487ff55-e821-4fcb-a730-af171dd2bac8,,0.0353,462147325,1,bradenton.com,news,Bradenton Herald,2024-08-24
